Region XI,Digos City,Digos Occidental,410289,"Davao Del Sur Institute of Languages and Technological College, Inc.","Door 1, Durano Building",DAVAO DEL SUR,CITY OF DIGOS (Capital),1st District,ZONE 2 (POB.),Private,Non-Sectarian ,School with no Annexes,Purely SHS,5,14,65,76,0,0,11,13,0,0,68,40,0,0,0,0,10,30,86,120,0,0,31,29,0,0,0,0,0,0,0,0,0,276,322,598
Region XI,Digos City,Digos Oriental,405791,"Mary Mediatrix of all Graces Academy, Inc.",Lapu-Lapu Ext.,DAVAO DEL SUR,CITY OF DIGOS (Capital),1st District,ZONE 3 (POB.),Private,Non-Sectarian ,School with no Annexes,Purely SHS,0,0,40,59,0,0,1,2,0,0,93,49,0,0,0,0,0,0,51,85,0,0,4,10,0,0,104,94,0,0,0,0,0,293,299,592
Region XI,Digos City,Digos Oriental,406623,"Saver's Technological College of Davao, Inc.","Roxas corner Tirad Pass Streets, Zone III, Digos City, Davao Del Sur",DAVAO DEL SUR,CITY OF DIGOS (Capital),1st District,ZONE 3 (POB.),Private,Non-Sectarian ,School with no Annexes,Purely SHS,8,20,31,42,0,0,3,1,0,0,147,39,0,0,0,0,0,0,0,0,0,0,0,0,0,0,97,41,0,0,0,0,0,286,143,429
Region XI,Digos City,Digos Oriental,408900,"Philippine International Technological School, Inc.","Doña Aurora Extension, Digos City",DAVAO DEL SUR,CITY OF DIGOS (Capital),1st District,SAN JOSE (BALUTAKAY),Private,Non-Sectarian ,School with no Annexes,Purely SHS,5,25,30,47,0,0,0,0,0,0,81,47,0,0,0,0,20,49,83,103,0,0,0,0,0,0,129,101,0,0,0,0,0,348,372,720
Region XI,Digos City,Digos Oriental,410845,"Arkstone Academy, Inc.","Pag-Asa Drive, Mabini Extension, Zone 111",DAVAO DEL SUR,CITY OF DIGOS (Capital),1st District,ZONE 1 (POB.),Private,Non-Sectarian ,School with no Annexes,Purely SHS,2,13,79,90,0,0,30,33,0,0,0,0,0,0,0,0,0,0,0,0,0,0,0,0,0,0,0,0,0,0,0,0,0,111,136,247
Region XI,Panabo City,Panabo Central,341574,Panabo City Senior High School,Brgy New Visayas,DAVAO DEL NORTE,CITY OF PANABO,2nd District,NEW VISAYAS,Public,DepED Managed,School with no Annexes,Purely SHS,43,142,91,202,0,0,14,55,0,0,314,207,0,0,0,0,40,156,150,251,0,0,37,57,0,0,194,130,0,0,0,0,0,883,1200,2083
Region XI,Panabo City,Panabo Central,403841,ACES Polytechnic College,"TADECO Rd., Brgy. San Francisco, Panabo City",DAVAO DEL NORTE,CITY OF PANABO,2nd District,SAN FRANCISCO (POB.),Private,Sectarian ,School with no Annexes,Purely SHS,0,6,3,16,4,5,1,1,0,0,12,8,0,0,0,0,5,7,7,17,6,8,0,3,0,0,15,11,0,0,0,0,0,53,82,135
Region XI,Panabo City,Panabo Central,403844,"Northlink Technological College, Inc.","National Highway, New Pandan, Panabo City, Davao del Norte",DAVAO DEL NORTE,CITY OF PANABO,2nd District,NEW PANDAN (POB.),Private,Non-Sectarian ,School with no Annexes,Purely SHS,6,57,50,84,29,55,6,12,0,0,69,67,0,0,0,0,7,34,40,78,0,0,7,18,0,0,56,53,0,0,0,0,0,270,458,728
Region XI,Panabo City,Panabo Central,403848,UM Panabo College,"Pedro N. Arguelles St., Brgy San Francisco, Panabo City",DAVAO DEL NORTE,CITY OF PANABO,2nd District,SAN FRANCISCO (POB.),Private,Sectarian ,School with no Annexes,Purely SHS,3,12,3,13,0,0,0,0,0,0,0,0,0,0,0,0,5,15,1,25,0,0,0,0,0,0,0,0,0,0,0,0,0,12,65,77
Region XI,Panabo City,Panabo Central,408585,"Valiant Technical Institute and Assessment Center, Inc.","Bangoy St., Salvacion, Panabo City",DAVAO DEL NORTE,CITY OF PANABO,2nd District,SALVACION,Private,Non-Sectarian ,School with no Annexes,Purely SHS,0,0,0,0,0,0,0,0,0,0,5,0,0,0,0,0,0,0,0,0,0,0,0,0,0,0,13,0,0,0,0,0,0,18,0,18
Region XI,Tagum City,Tagum City Central,305891,Tagum City Regional Academy for Senior High School,APOKON,DAVAO DEL NORTE,CITY OF TAGUM (Capital),1st District,MADAUM,Public,DepED Managed,School with no Annexes,Purely SHS,15,38,131,180,0,0,22,31,0,0,0,0,0,0,0,0,9,24,58,65,0,0,31,20,0,0,0,0,0,0,0,0,0,266,358,624
Region XI,Tagum City,Tagum City Central,403859,ACES Tagum College,"Mankilam, Tagum City, Davao del Norte",DAVAO DEL NORTE,CITY OF TAGUM (Capital),2nd District,MANKILAM,Private,Sectarian ,School with no Annexes,Purely SHS,6,7,5,26,4,23,3,1,0,0,32,8,0,0,0,0,2,10,18,34,11,19,5,7,0,0,26,12,0,0,0,0,0,112,147,259
Region XI,Tagum City,Tagum City Central,403862,STI College - Tagum,"Purok 1 Apokon Road, Brgy. Apokon, Tagum City",DAVAO DEL NORTE,CITY OF TAGUM (Capital),2nd District,MAGUGPO POBLACION,Private,Non-Sectarian ,School with no Annexes,Purely SHS,5,23,15,28,35,60,0,0,0,0,44,37,0,0,0,0,11,20,20,36,41,58,0,0,0,0,32,29,0,0,0,0,0,203,291,494
Region XI,Tagum City,Tagum City Central,403863,"Tagum Doctors College, Inc.","Mahogany St., Rabe Subd., Visayan Village, Tagum City, Davao del Norte",DAVAO DEL NORTE,CITY OF TAGUM (Capital),2nd District,VISAYAN VILLAGE,Private,Non-Sectarian ,School with no Annexes,Purely SHS,0,0,0,1,21,66,0,0,0,0,0,0,0,0,0,0,0,0,0,9,14,49,0,0,0,0,0,0,0,0,0,0,0,35,125,160
Region XI,Tagum City,Tagum City Central,403867,"CARD-MRI Development Institute, Inc.","Purok Caimito, Brgy. Mankilam, Tagum City, Davao del Norte",DAVAO DEL NORTE,CITY OF TAGUM (Capital),2nd District,MANKILAM,Private,Non-Sectarian ,School with no Annexes,Purely SHS,27,53,0,0,0,0,0,0,0,0,72,100,0,0,0,0,25,87,0,0,0,0,0,0,0,0,72,59,0,0,0,0,0,196,299,495
Region XI,Tagum City,Tagum City Central,407265,"Mindtechs Institute of Technology, Inc.","Seminary Drive, Tagum City, Davao del Norte",DAVAO DEL NORTE,CITY OF TAGUM (Capital),2nd District,MAGUGPO WEST,Private,Non-Sectarian ,School with no Annexes,Purely SHS,0,0,0,0,0,0,17,20,0,0,26,58,0,0,0,0,0,0,0,0,0,0,22,56,0,0,31,74,0,0,0,0,0,96,208,304
Region XI,Tagum City,Tagum City Central,410815,"The Rizal Memorial Colleges, Inc.",Purok Gulayan,DAVAO DEL NORTE,CITY OF TAGUM (Capital),1st District,MANKILAM,Private,Non-Sectarian ,School with no Annexes,Purely SHS,30,74,132,152,118,170,19,19,0,0,87,48,0,0,0,0,2,8,25,21,7,17,8,9,0,0,8,5,0,0,0,0,0,436,523,959
Region XI,Tagum City,Tagum City Central,410963,"Technical Education School and Assessment Center of Tagum, Inc.","Purok Dahlia, Visayan Village",DAVAO DEL NORTE,CITY OF TAGUM (Capital),1st District,VISAYAN VILLAGE,Private,Non-Sectarian ,School with no Annexes,Purely SHS,0,0,0,0,0,0,1,2,0,0,13,6,0,0,0,0,0,0,0,0,0,0,0,0,0,0,0,0,0,0,0,0,0,14,8,22
Region XI,Island Garden City of Samal,Babak,410540,"Prestige School of Technology, Inc.",-,DAVAO DEL NORTE,ISLAND GARDEN CITY OF SAMAL,2nd District,MIRANDA (POB.),Private,Non-Sectarian ,School with no Annexes,Purely SHS,0,0,0,0,0,0,0,0,0,0,0,5,0,0,0,0,0,0,0,0,0,0,0,0,0,0,2,10,0,0,0,0,0,2,15,17
Region XI,Island Garden City of Samal,Samal,341526,Samal Senior High School,"Sitio Pasig,Penaplata, Samal District, Island Garden City of Samal",DAVAO DEL NORTE,ISLAND GARDEN CITY OF SAMAL,2nd District,PEÑAPLATA (POB.),Public,DepED Managed,School with no Annexes,Purely SHS,0,0,0,0,18,33,16,18,0,0,71,38,0,0,0,0,0,0,0,0,10,14,32,49,0,0,84,36,0,0,0,0,0,231,188,419
Region XI,Island Garden City of Samal,Samal,403851,UNIVERSITY OF MINDANAO PEÑAPLATA COLLEGE,"Obenza St. Peñaplata, District II, Island Garden City of Samal",DAVAO DEL NORTE,ISLAND GARDEN CITY OF SAMAL,2nd District,PEÑAPLATA (POB.),Private,Sectarian ,School with no Annexes,Purely SHS,8,7,9,14,0,0,0,0,0,0,0,0,0,0,0,0,8,19,10,14,0,0,0,0,0,0,0,0,0,0,0,0,0,35,54,89
Region XI,Island Garden City of Samal,Samal,407253,IGB Samal Function House & Training Center,"Brgy. Catagman, Island Garden of City of Samal, Davao del Norte",DAVAO DEL NORTE,ISLAND GARDEN CITY OF SAMAL,2nd District,CATAGMAN,Private,Sectarian ,School with no Annexes,Purely SHS,0,0,0,0,0,0,6,12,0,0,21,12,0,0,0,0,0,0,0,0,0,0,0,1,0,0,13,2,0,0,0,0,0,40,27,67
Region XI,Mati City,Mati Central,405812,"Don Bosco Training Center-Mati, Inc.","Don Bosco Compound, Brgy. Dahican, Mati City, Davao Oriental",DAVAO ORIENTAL,CITY OF MATI (Capital),2nd District,DAHICAN,Private,Non-Sectarian ,School with no Annexes,Purely SHS,0,0,0,0,0,0,0,0,0,0,75,17,0,0,0,0,0,0,0,0,0,0,0,0,0,0,84,24,0,0,0,0,0,159,41,200
Region XI,Mati City,Mati Central,410494,"Career Centre Academie and Technological Institute, Inc.",BGR Phase II,DAVAO ORIENTAL,CITY OF MATI (Capital),1st District,DAHICAN,Private,Non-Sectarian ,School with no Annexes,Purely SHS,0,5,2,8,0,0,6,6,0,0,9,12,0,0,0,0,4,1,0,0,0,0,4,2,0,0,2,5,0,0,0,0,0,27,39,66
Region XI,Mati City,Mati Central,410843,"Dvo. Oriental Institute of Technology, Inc.","Tindalo St., Barangay Sainz",DAVAO ORIENTAL,CITY OF MATI (Capital),2nd District,SAINZ,Private,Non-Sectarian ,School with no Annexes,Purely SHS,0,0,0,0,0,0,0,0,0,0,45,56,0,0,0,0,0,0,0,0,0,0,0,0,0,0,0,0,0,0,0,0,0,45,56,101
Region XII,North Cotabato,Kabacan South,410703,"COLEGIO DE MAHARLIKA OF NORTH COTABATO, INC.","ABELLERA ST., CORNER VILLANUEV  SUBD.., POBLACION, KABACAN, COTABATO",NORTH COTABATO,KABACAN,1st District,POBLACION,Private,Non-Sectarian ,School with no Annexes,Purely SHS,18,33,114,169,3,13,0,0,0,0,60,40,0,0,0,0,5,5,51,84,9,24,0,0,0,0,6,4,0,0,0,0,0,266,372,638
Region XII,North Cotabato,Makilala Central,410842,"COLEGIO DE MAHARLIKA OF MAKILALA, INC.","TEJADA SUBDIVISION, POBLACION MAKILALA, COTABATO",NORTH COTABATO,MAKILALA,2nd District,POBLACION,Private,Non-Sectarian ,School with no Annexes,Purely SHS,1,3,7,13,0,1,0,0,0,0,1,3,0,0,0,0,1,4,10,20,0,1,0,0,0,0,8,8,0,0,0,0,0,28,53,81
Region XII,Sarangani,East Alabel,405836,"Green Valley College Foundation, Inc.-Maasim","Poblacion, Maasim, Sarangani Province",SARANGANI,MAASIM,Lone District,POBLACION (MAASIM),Private,Sectarian ,School with no Annexes,Purely SHS,0,0,11,20,0,0,0,0,0,0,0,0,0,0,0,0,0,0,11,14,0,0,0,0,0,0,0,0,0,0,0,0,0,22,34,56
Region XII,Sarangani,Central Glan,405835,"Green Valley College Foundation, Inc.-Glan","Poblacion, Glan, Sarangani Province",SARANGANI,GLAN,Lone District,POBLACION,Private,Sectarian ,School with no Annexes,Purely SHS,3,4,6,7,0,0,0,0,0,0,0,0,0,0,0,0,2,4,3,4,0,0,0,0,0,0,0,0,0,0,0,0,0,14,19,33
Region XII,Sarangani,South Malungon,410779,"GOLDENSTATE COLLEGE OF MALUNGON, INC.","BASAK, MALANDAG, MALUNGON, SARANGANI",SARANGANI,MALUNGON,Lone District,MALANDAG,Private,Non-Sectarian ,School with no Annexes,Purely SHS,3,3,4,9,0,0,0,0,0,0,2,2,0,0,0,0,0,1,4,13,0,0,0,0,0,0,1,5,0,0,0,0,0,14,33,47
Region XII,Sarangani,West Kiamba,407002,"Euro Asia College of Technology, Inc.","C.T. Martinez Cor. I. Lopez Sts., Poblacion, Kiamba, Sarangani Province",SARANGANI,KIAMBA,Lone District,POBLACION,Private,Sectarian ,School with no Annexes,Purely SHS,0,0,0,0,0,0,0,0,0,0,73,37,0,0,0,0,0,0,0,0,0,0,0,0,0,0,39,26,0,0,0,0,0,112,63,175
Region XII,Sarangani,West Kiamba,410778,"GOLDENSTATE COLLEGE OF KIAMBA, INC.","ST. ANTHONY ST., POBLACION, KIAMBA, SARANGANI",SARANGANI,MALUNGON,Lone District,POBLACION,Private,Non-Sectarian ,School with no Annexes,Purely SHS,1,1,19,28,0,0,0,0,0,0,12,7,0,0,0,0,1,3,8,4,0,0,0,0,0,0,0,0,0,0,0,0,0,41,43,84
Region XII,Sarangani,West Maasim,410463,"Golden State College Of Maasim, Inc.",ST. ANGEL STREET POBLACION MAASIM,SARANGANI,MAASIM,Lone District,POBLACION (MAASIM),Private,Non-Sectarian ,School with no Annexes,Purely SHS,0,13,36,32,0,0,0,0,0,0,9,10,0,0,0,0,0,1,14,25,0,0,0,0,0,0,0,0,0,0,0,0,0,59,81,140
Region XII,South Cotabato,Banga East,406641,"Green Valley College Foundation, Inc. - Banga","Poblacion, Banga, South Cotabato",SOUTH COTABATO,BANGA,2nd District,REYES (POB.),Private,Sectarian ,School with no Annexes,Purely SHS,0,0,0,0,0,0,0,0,0,0,19,25,0,0,0,0,0,0,0,0,0,0,0,0,0,0,48,17,0,0,0,0,0,67,42,109
Region XII,South Cotabato,Banga East,406643,"Green Valley College Foundation, Inc. - T'boli","Poblacion, T'boli, South Cotabato",SOUTH COTABATO,T'BOLI,2nd District,POBLACION,Private,Sectarian ,School with no Annexes,Purely SHS,3,5,35,52,0,0,0,0,0,0,26,7,0,0,0,0,5,27,23,75,0,0,0,0,0,0,11,19,0,0,0,0,0,103,185,288
Region XII,South Cotabato,Lake Sebu East,360849,Tboli Sbu Senior High School,Lamdalag,SOUTH COTABATO,LAKE SEBU,2nd District,LAMDALAG,Public,DepED Managed,School with no Annexes,Purely SHS,0,0,31,38,0,0,0,0,0,0,33,9,0,0,0,0,0,0,34,31,0,0,0,0,0,0,13,15,0,0,0,0,0,111,93,204
Region XII,South Cotabato,Sto. Niño,409907,"Roel Balbarono Ardiente College, Inc.","Poblacion, Sto. Nino, South Cotabato",SOUTH COTABATO,SANTO NIÑO,2nd District,POBLACION,Private,Non-Sectarian ,School with no Annexes,Purely SHS,0,0,34,60,0,0,0,0,0,0,29,30,0,0,0,0,0,0,21,30,0,0,0,0,0,0,4,7,0,0,0,0,0,88,127,215
Region XII,South Cotabato,Surallah Central,407759,"SURALLAH INSTITUTE OF TECHNOLOGY, INC.","Bautista Subdivision, Allah Valley Drive, Surallah",SOUTH COTABATO,SURALLAH,2nd District,LIBERTAD (POB.),Private,Non-Sectarian ,School with no Annexes,Purely SHS,0,0,0,0,0,0,0,0,0,0,75,3,0,0,0,0,0,0,0,0,0,0,0,0,0,0,46,0,0,0,0,0,0,121,3,124
Region XII,South Cotabato,T ' Boli East,410883,"MARVELOUS COLLEGE OF TECHNOLOGY-T'BOLI CAMPUS, INC.","PUROK GLUYAN, BRGY. POBLACION, T'BOLI, SOUTH COTABATO",SOUTH COTABATO,T'BOLI,2nd District,POBLACION,Private,Non-Sectarian ,School with no Annexes,Purely SHS,0,0,0,0,0,0,0,0,0,0,22,48,0,0,0,0,0,0,0,0,0,0,0,0,0,0,0,0,0,0,0,0,0,22,48,70
Region XII,Sultan Kudarat,Isulan Central,403947,"Green Valley College Foundation, Inc. - Isulan",National Highway,SULTAN KUDARAT,ISULAN (Capital),1st District,KALAWAG II (POB.),Private,Sectarian ,School with no Annexes,Purely SHS,0,0,0,0,0,0,0,0,0,0,100,138,0,0,0,0,0,0,0,0,0,0,0,0,0,0,112,133,0,0,0,0,0,212,271,483
Region XII,Sultan Kudarat,Isulan Central,407417,"International School for Advance Genuine and Education, Inc.",New Capitol Site,SULTAN KUDARAT,ISULAN (Capital),1st District,KENRAM,Private,Sectarian ,School with no Annexes,Purely SHS,0,0,91,92,0,0,0,0,0,0,0,0,0,0,0,0,0,0,15,13,0,0,0,0,0,0,0,0,0,0,0,0,0,106,105,211
Region XII,Sultan Kudarat,Lebak West,403949,"West Celebes College of Technology, Inc.",Brgy. Aurelio F. Freires Sr.,SULTAN KUDARAT,LEBAK,2nd District,SALAMAN,Private,Non-Sectarian ,School with no Annexes,Purely SHS,0,0,0,0,0,0,0,0,0,0,8,3,0,0,0,0,0,0,0,0,0,0,0,0,0,0,13,16,0,0,0,0,0,21,19,40
Region XII,General Santos City,General Santos City North District,403883,AMA Computer College-General Santos City,"AMA Bldg., J.P Laurel Ave., General Santos City",SOUTH COTABATO,GENERAL SANTOS CITY (DADIANGAS),1st District,DADIANGAS NORTH,Private,Non-Sectarian ,School with no Annexes,Purely SHS,2,4,0,0,0,0,0,0,0,0,10,4,0,0,0,0,1,3,0,0,0,0,0,0,0,0,12,11,0,0,0,0,0,25,22,47
Region XII,General Santos City,General Santos City North District,403897,Goldenstate College,"Pedro Acharon Boulevard, Brgy. Dadiangas South, General Santos City",SOUTH COTABATO,GENERAL SANTOS CITY (DADIANGAS),1st District,DADIANGAS SOUTH,Private,Non-Sectarian ,School with no Annexes,Purely SHS,6,8,18,17,0,0,0,0,0,0,66,27,0,0,0,0,73,185,289,373,0,0,11,23,0,0,191,113,0,0,0,0,0,654,746,1400
Region XII,General Santos City,General Santos City North District,403899,STI College - Gen. Santos Inc.,"STI Academic Center, J. Catolico Avenue, General Santos City 9500",SOUTH COTABATO,GENERAL SANTOS CITY (DADIANGAS),1st District,LAGAO (1ST & 3RD),Private,Non-Sectarian ,School with no Annexes,Purely SHS,11,31,22,30,41,57,0,0,0,0,50,47,0,0,0,0,5,32,14,11,25,43,0,0,0,0,38,31,0,0,0,0,0,206,282,488
Region XII,General Santos City,General Santos City North District,403900,Villamor College of Business and Arts Inc.,Balimbing Street Barangay North,SOUTH COTABATO,GENERAL SANTOS CITY (DADIANGAS),1st District,DADIANGAS NORTH,Private,Sectarian ,School with no Annexes,Purely SHS,4,7,12,11,0,0,3,1,0,0,9,5,0,0,0,0,0,5,3,4,0,0,2,8,0,0,7,9,0,0,0,0,0,40,50,90
Region XII,General Santos City,General Santos City North District,405950,"Brokenshire College - SOCSKSARGEN, Inc.","Ced Avenue, National Highway, Lagao, General Santos City, South Cotabato",SOUTH COTABATO,GENERAL SANTOS CITY (DADIANGAS),1st District,LAGAO (1ST & 3RD),Private,Non-Sectarian ,School with no Annexes,Purely SHS,0,0,2,3,5,17,0,0,0,0,0,0,0,0,0,0,0,2,2,2,3,4,0,0,0,0,0,0,0,0,0,0,0,12,28,40
Region XII,General Santos City,General Santos City North District,406625,"Passionist Technological Institute, Inc.","Holy Cross Parish Compound, Brgy. Calumpang, General Santos City, South Cotabato",SOUTH COTABATO,GENERAL SANTOS CITY (DADIANGAS),1st District,CALUMPANG,Private,Sectarian ,School with no Annexes,Purely SHS,2,11,15,13,0,0,0,0,0,0,114,17,0,0,0,0,4,14,5,11,0,0,0,0,0,0,70,18,0,0,0,0,0,210,84,294
Region XII,General Santos City,General Santos City North District,407006,"General Santos Doctors' Medical School Foundation, Inc.","Bulaong Subdivision, Barangay West, General Santos City",SOUTH COTABATO,GENERAL SANTOS CITY (DADIANGAS),1st District,DADIANGAS WEST,Private,Sectarian ,School with no Annexes,Purely SHS,0,0,0,0,13,50,0,0,0,0,0,0,0,0,0,0,0,0,0,0,16,63,0,0,0,0,0,0,0,0,0,0,0,29,113,142
Region XII,General Santos City,General Santos City West District,409814,"NEW BRIGHTON SCHOOL OF THE PHILIPPINES, INC.","010 Quezon Avenue, Brgy. Dadiangas West, General Santos City",SOUTH COTABATO,GENERAL SANTOS CITY (DADIANGAS),1st District,DADIANGAS WEST,Private,Non-Sectarian ,School with no Annexes,Purely SHS,1,2,6,1,8,21,0,0,0,0,0,0,0,0,0,0,4,4,5,6,26,35,0,0,0,0,0,0,0,0,0,0,0,50,69,119
Region XII,General Santos City,General Santos City South District,403891,"Gensan College of Technology, Inc.","23 GCT Bldg., Camia St., Brgy. East, General Santos City",SOUTH COTABATO,GENERAL SANTOS CITY (DADIANGAS),1st District,DADIANGAS EAST (POB.),Private,Sectarian ,School with no Annexes,Purely SHS,0,0,0,0,0,0,0,0,0,0,5,1,0,0,0,0,0,0,0,0,0,0,0,0,0,0,7,6,0,0,0,0,0,12,7,19
Region XII,General Santos City,General Santos City South District,409556,"MMG School of Paramedics and Allied Sciences, Inc.",RDRDC Building Santiago Blvd.,SOUTH COTABATO,GENERAL SANTOS CITY (DADIANGAS),1st District,DADIANGAS SOUTH,Private,Non-Sectarian ,School with no Annexes,Purely SHS,0,0,0,0,0,0,0,0,0,0,0,0,0,0,0,0,0,0,0,0,2,2,0,0,0,0,0,0,0,0,0,0,0,2,2,4
Region XII,General Santos City,Cahilsot,410340,"PACIFIC SOUTHBAY COLLEGE, INC.","A. MABINI ST., PUROK CARMENVILLE, BRGY. CALUMPANG, GENERAL SANTOS CITY",SOUTH COTABATO,GENERAL SANTOS CITY (DADIANGAS),1st District,CALUMPANG,Private,Non-Sectarian ,School with no Annexes,Purely SHS,33,73,144,153,0,0,0,0,0,0,0,0,0,0,0,0,21,56,114,123,0,0,0,0,0,0,0,0,0,0,0,0,0,312,405,717
Region XII,General Santos City,Katangawan,409557,"Envirogreen Village Educational Foundation, Inc.",Purok 7,SOUTH COTABATO,GENERAL SANTOS CITY (DADIANGAS),1st District,KATANGAWAN,Private,Non-Sectarian ,School with no Annexes,Purely SHS,0,2,7,2,0,0,0,0,0,0,4,9,0,0,0,0,0,1,4,0,0,0,0,0,0,0,1,2,0,0,0,0,0,16,16,32
Region XII,General Santos City,Apopong,409555,MINDANAO POLYTECHNIC COLLEGE,MAKAR JUNCTION,SOUTH COTABATO,GENERAL SANTOS CITY (DADIANGAS),1st District,APOPONG,Private,Non-Sectarian ,School with no Annexes,Purely SHS,1,4,9,3,5,1,0,0,5,5,0,0,0,0,0,0,2,1,6,6,2,4,0,0,13,1,1,0,0,0,0,0,0,44,25,69
Region XII,General Santos City,Labangal,407653,King Solomon Institute Academy Inc.,"Lower Makr, Brgy. Labangal, General Santos City",SOUTH COTABATO,GENERAL SANTOS CITY (DADIANGAS),1st District,LABANGAL,Private,Non-Sectarian ,School with no Annexes,Purely SHS,7,9,16,47,0,0,1,6,0,0,97,28,0,0,0,0,4,34,15,50,0,0,3,20,0,0,63,9,0,0,0,0,0,206,203,409
Region XII,Kidapawan City,Kidapawan City District I,404010,North Valley College Foundation Inc.,"National Highway, Lanao",NORTH COTABATO,CITY OF KIDAPAWAN (Capital),2nd District,LANAO,Private,Sectarian ,School with no Annexes,Purely SHS,0,7,14,15,18,36,0,0,0,0,4,0,0,0,0,0,0,6,6,10,19,23,0,0,0,0,7,6,0,0,0,0,0,68,103,171
Region XII,Kidapawan City,Kidapawan City District I,405862,Central Mindanao Colleges,Osmeña Drive,NORTH COTABATO,CITY OF KIDAPAWAN (Capital),2nd District,POBLACION,Private,Non-Sectarian ,School with no Annexes,Purely SHS,7,23,24,43,26,44,0,0,0,0,12,7,0,0,0,0,12,20,41,35,35,43,0,0,0,0,8,4,0,0,0,0,0,165,219,384
Region XII,Koronadal City,Koronadal East District I,403901,ACLC College of Marbel,3F Del Rosario Bldg. Gen. Santos Drive cor. Zulueta St. Koronadal City South Cotabato,SOUTH COTABATO,CITY OF KORONADAL (Capital),2nd District,ZONE I (POB.),Private,Non-Sectarian ,School with no Annexes,Purely SHS,0,0,3,5,0,0,0,0,0,0,0,0,0,0,0,0,0,0,2,6,0,0,0,0,0,0,0,0,0,0,0,0,0,5,11,16
Region XII,Koronadal City,Koronadal East District I,403916,"Goldenstate College of Koronadal City, Inc.","Alunan Avenue, Mother Francisca Bldg., Zone 3, Koronadal City, South Cotabato",SOUTH COTABATO,CITY OF KORONADAL (Capital),2nd District,ZONE III (POB.),Private,Non-Sectarian ,School with no Annexes,Purely SHS,1,8,19,29,0,0,3,2,0,0,20,12,0,0,0,0,7,10,34,51,0,0,3,8,0,0,7,7,0,0,0,0,0,94,127,221
Region XII,Koronadal City,Koronadal East District I,403941,Regency Polytechnic College-Maritime High School,"Gensan Drive, Brgy. Morales, Koronadal City, South Cotabato",SOUTH COTABATO,CITY OF KORONADAL (Capital),2nd District,MORALES,Private,Non-Sectarian ,School with no Annexes,Purely SHS,0,0,0,0,5,1,0,0,0,0,0,0,0,0,0,0,0,0,0,0,6,4,0,0,0,0,0,0,0,0,0,0,0,11,5,16
Region XII,Koronadal City,Koronadal East District I,403946,STI College - Koronadal,"Sta. Lucia St., Odi Confessor, City of Koronadal",SOUTH COTABATO,CITY OF KORONADAL (Capital),2nd District,ZONE III (POB.),Private,Non-Sectarian ,School with no Annexes,Purely SHS,6,8,18,10,11,31,0,0,0,0,0,0,0,0,0,0,4,9,7,8,6,12,0,0,0,0,8,3,0,0,0,0,0,60,81,141
Region XII,Koronadal City,Koronadal East District I,405948,"Ramon Magsaysay Memorial Colleges-Marbel, Inc.","Unit 7, LV Bldg. Alunan Avenue, Zone III, Koronadal City, South Cotabato",SOUTH COTABATO,CITY OF KORONADAL (Capital),2nd District,ZONE III (POB.),Private,Non-Sectarian ,School with no Annexes,Purely SHS,2,10,23,31,8,31,0,0,0,0,0,0,0,0,0,0,5,23,25,46,14,35,0,0,0,0,0,0,0,0,0,0,0,77,176,253
Region XII,Koronadal City,Koronadal East District I,406318,Sta. Cruz Technical and Vocational School Inc.,"Sta. Cruz., Koronadal City",SOUTH COTABATO,CITY OF KORONADAL (Capital),2nd District,SANTA CRUZ,Private,Sectarian ,School with no Annexes,Purely SHS,0,0,2,12,0,0,0,0,0,0,30,16,0,0,0,0,0,0,0,13,0,0,0,0,0,0,38,6,0,0,0,0,0,70,47,117
Region XII,Koronadal City,Koronadal East District I,406631,"Marbel Institute of Technical College, Inc.","Alunan Ave., Zone IV, Koronadal City, South Cotabato",SOUTH COTABATO,CITY OF KORONADAL (Capital),2nd District,ZONE IV (POB.),Private,Non-Sectarian ,School with no Annexes,Purely SHS,0,0,5,8,0,0,0,0,0,0,2,7,0,0,0,0,0,0,15,20,0,0,0,0,0,0,8,8,0,0,0,0,0,30,43,73
Region XII,Koronadal City,Koronadal East District I,407991,"Southern Philippine Technical College of Koronadal, Inc.","Satellite Market Chinatown Brgy. General Paulino Santos, City of Koronadal",SOUTH COTABATO,CITY OF KORONADAL (Capital),2nd District,ZONE III (POB.),Private,Non-Sectarian ,School with no Annexes,Purely SHS,0,0,9,17,0,0,0,0,0,0,18,3,0,0,0,0,0,0,2,23,0,0,0,0,0,0,11,5,0,0,0,0,0,40,48,88
Region XII,Koronadal City,Koronadal East District II,410885,"SOUTH ASIATECH COLLEGE, INC.","081 PUROK MAHARLIKA, NIA RD., BRGY. GPS, KORONADAL CITY",SOUTH COTABATO,CITY OF KORONADAL (Capital),2nd District,GENERAL PAULINO SANTOS (BO. 1),Private,Non-Sectarian ,School with no Annexes,Purely SHS,0,0,0,0,0,0,0,0,0,0,14,20,0,0,0,0,0,0,0,0,0,0,0,0,0,0,0,0,0,0,0,0,0,14,20,34
Region XII,Tacurong City,Tacurong East,403952,STI College Tacurong,"National Highway, Brgy. Buenaflor, Tacurong City",SULTAN KUDARAT,CITY OF TACURONG,1st District,BUENAFLOR,Private,Non-Sectarian ,School with no Annexes,Purely SHS,7,10,0,0,11,7,0,0,0,0,0,0,0,0,0,0,1,12,3,10,5,10,0,0,0,0,0,0,0,0,0,0,0,27,49,76
CARAGA,Agusan del Norte,Carmen,340204,"SHS in Carmen, Agusan Del Norte",Poblacion,AGUSAN DEL NORTE,CARMEN,2nd District,POBLACION (CARMEN),Public,DepED Managed,School with no Annexes,Purely SHS,4,14,29,44,16,16,10,14,0,0,34,36,0,0,0,0,2,18,68,59,19,27,10,11,0,0,24,18,0,0,0,0,0,216,257,473
CARAGA,Agusan del Sur,Bunawan I,405819,"Asian Skills Academy Foundation, Inc.","Purok 5-B, Poblacion, Trento, Agusan del Sur",AGUSAN DEL SUR,TRENTO,Lone District,POBLACION,Private,Sectarian ,School with no Annexes,Purely SHS,5,19,18,64,0,0,7,13,0,0,188,78,0,0,0,0,5,13,17,78,0,0,5,19,0,0,186,68,0,0,0,0,0,431,352,783
CARAGA,Agusan del Sur,Bunawan I,405821,"Computer Research Network, Inc.-Main Campus","Poblacion, Trento, Agusan del Sur",AGUSAN DEL SUR,TRENTO,Lone District,POBLACION,Private,Non-Sectarian ,School with no Annexes,Purely SHS,0,0,0,0,0,0,0,0,0,0,118,51,0,0,0,0,0,0,0,0,0,0,0,0,0,0,102,58,0,0,0,0,0,220,109,329
CARAGA,Agusan del Sur,Bunawan I,405823,"Informatic Computer Institute of Agusan del Sur, Inc","Center Island, San Francisco, Agusan del Sur",AGUSAN DEL SUR,SAN FRANCISCO,2nd District,BARANGAY 3 (POB.),Private,Non-Sectarian ,School with no Annexes,Purely SHS,0,0,0,0,0,0,29,79,0,0,247,269,0,0,0,0,0,0,0,0,0,0,125,207,0,0,417,489,0,0,0,0,0,818,1044,1862
CARAGA,Agusan del Sur,San Francisco I,409843,ERG Technical Training Center Inc.,"Purok 4A, Barangay 5, San Francisco, Agusan del Sur",AGUSAN DEL SUR,SAN FRANCISCO,2nd District,BARANGAY 5 (POB.),Private,Non-Sectarian ,School with no Annexes,Purely SHS,3,18,0,0,0,0,0,0,0,0,25,24,0,0,0,0,6,16,0,0,0,0,0,0,0,0,13,6,0,0,0,0,0,47,64,111
CARAGA,Agusan del Sur,San Francisco I,410589,Brooklane College of San Francisco Inc.,"Orange St., Brgy. 4, San Francisco, Agusan del Sur",AGUSAN DEL SUR,SAN FRANCISCO,2nd District,BARANGAY 4 (POB.),Private,Non-Sectarian ,School with no Annexes,Purely SHS,1,4,2,8,0,0,34,31,0,0,5,6,0,0,0,0,1,2,1,4,0,0,5,13,0,0,0,1,0,0,0,0,0,49,69,118
CARAGA,Agusan del Sur,Sibagat I,407577,"Father Saturnino Urios College of Sibagat, Inc.","Poblacion, Sibagat, Agusan del Sur",AGUSAN DEL SUR,SIBAGAT,Lone District,POBLACION,Private,Sectarian ,School with no Annexes,Purely SHS,16,7,34,38,14,33,10,7,0,0,22,7,0,0,0,0,1,7,37,51,22,30,3,4,0,0,9,1,0,0,0,0,0,168,185,353
CARAGA,Butuan City,Central Butuan District I,404075,Asian College Foundation,"Km. 3, J.C. Aquino Avenue, Butuan City, Agusan Del Norte",AGUSAN DEL NORTE,BUTUAN CITY (Capital),1st District,BAYANIHAN POB. (BGY. 27),Private,Sectarian ,School with no Annexes,Purely SHS,0,0,4,4,0,0,7,2,0,0,1,2,0,0,0,0,0,0,5,3,0,0,8,7,0,0,2,1,0,0,0,0,0,27,19,46
