region,division,district,beis_school_id,school_name,street_address,province,municipality,legislative_district,barangay,sector,school_subclassification,school_type,modified_coc,g11_acad_-_abm_male,g11_acad_-_abm_female,g11_acad_-_humss_male,g11_acad_-_humss_female,g11_acad_stem_male,g11_acad_stem_female,g11_acad_gas_male,g11_acad_gas_female,g11_acad_pbm_male,g11_acad_pbm_female,g11_tvl_male,g11_tvl_female,g11_sports_male,g11_sports_female,g11_arts_male,g11_arts_female,g12_acad_-_abm_male,g12_acad_-_abm_female,g12_acad_-_humss_male,g12_acad_-_humss_female,g12_acad_stem_male,g12_acad_stem_female,g12_acad_gas_male,g12_acad_gas_female,g12_acad_pbm_male,g12_acad_pbm_female,g12_tvl_male,g12_tvl_female,g12_sports_male,g12_sports_female,g12_arts_male,g12_arts_female,total_non_graded_enrollment,total_male_enrollment,total_female_enrollment,total_enrollment
Region I,Ilocos Sur,Bantay,600237,Ilocos Sur Community College,Zone V,ILOCOS SUR,BANTAY,1st District,BARANGAY 5 (POB.),SUCsLUCs,LUC,School with no Annexes,Purely SHS,5,5,34,30,0,0,0,0,0,0,20,21,0,0,0,0,2,7,30,23,0,0,0,0,0,0,37,15,0,0,0,0,0,128,101,229
Region I,Ilocos Sur,Cervantes-Quirino,600324,ISPSC Cervantes Campus,"Cervantes Campus, Cervantes, Ilocos Sur",ILOCOS SUR,CERVANTES,1st District,ROSARIO (POB.),SUCsLUCs,SUC Managed,School with no Annexes,Purely SHS,0,0,0,0,0,0,0,0,0,0,0,0,0,0,0,0,0,0,0,0,8,16,0,0,0,0,8,10,0,0,0,0,0,16,26,42
Region I,Ilocos Sur,Santiago,600325,ISPSC Santiago Campus,"Santiago Campus, Santiago, Ilocos Sur",ILOCOS SUR,SANTIAGO,1st District,POBLACION NORTE,SUCsLUCs,SUC Managed,School with no Annexes,Purely SHS,0,0,0,0,0,0,0,0,0,0,0,0,0,0,0,0,0,0,0,0,3,10,0,2,0,0,0,2,0,0,0,0,0,3,14,17
Region I,La Union,Aringay,340822,Aringay Senior High School,-,LA UNION,ARINGAY,2nd District,SANTA RITA EAST,Public,DepED Managed,School with no Annexes,Purely SHS,0,0,0,0,0,0,0,0,0,0,32,34,0,0,0,0,0,0,0,0,0,0,0,0,0,0,33,22,0,0,0,0,0,65,56,121
Region I,La Union,Naguilian,340823,Naguilian Senior High School,"P. Florendo St. Ortiz, Naguilian, La Union",LA UNION,NAGUILIAN,2nd District,ORTIZ (POB.),Public,DepED Managed,School with no Annexes,Purely SHS,0,0,0,0,0,0,0,0,0,0,171,87,0,0,0,0,0,0,0,0,0,0,0,0,0,0,105,62,0,0,0,0,0,276,149,425
Region I,La Union,San Gabriel,340825,San Gabriel Senior High School,"Poblacion, San Gabriel, La Union",LA UNION,SAN GABRIEL,1st District,POBLACION,Public,DepED Managed,School with no Annexes,Purely SHS,5,20,52,32,0,0,12,24,0,0,0,0,0,0,0,0,3,9,31,37,0,0,34,14,0,0,0,0,0,0,0,0,0,137,136,273
Region I,La Union,San Juan,340824,San Juan Senior High School,"Ili Sur, San Juan, La Union",LA UNION,SAN JUAN,1st District,ILI SUR (POB.),Public,DepED Managed,School with no Annexes,Purely SHS,14,28,37,37,22,26,0,0,0,0,48,25,0,0,0,0,13,17,53,47,12,27,0,0,0,0,51,24,0,0,0,0,0,250,231,481
Region I,"Pangasinan I, Lingayen",Calasiao I,401732,AMA Computer College-Pangasinan Inc.,"Brgy. San Miguel, Mc Arthur Highway, Calasiao Junction, Calasiao Pangasinan",PANGASINAN,CALASIAO,3rd District,SAN MIGUEL,Private,Non-Sectarian ,School with no Annexes,Purely SHS,0,1,2,2,7,13,0,0,0,0,4,4,0,0,0,0,0,3,1,0,6,4,0,2,0,0,3,3,0,0,0,0,0,23,32,55
Region I,"Pangasinan I, Lingayen",Calasiao I,407618,Señor Tesoro College,"Diversion Road, San Miguel, Calasiao, Pangasinan",PANGASINAN,CALASIAO,3rd District,SAN MIGUEL,Private,Sectarian ,School with no Annexes,Purely SHS,0,0,0,0,0,0,0,0,0,0,29,19,0,0,0,0,0,0,0,0,0,0,0,0,0,0,13,10,0,0,0,0,0,42,29,71
Region I,"Pangasinan I, Lingayen",Malasiqui I,409994,"MARIAN EDUCATIONAL CENTER OF MALASIQUI, INC.",31 BRGY. TAMBAC,PANGASINAN,MALASIQUI,3rd District,TAMBAC,Private,Non-Sectarian ,School with no Annexes,Purely SHS,0,0,0,6,0,0,1,2,0,0,27,1,0,0,0,0,0,3,2,11,0,0,4,2,0,0,25,0,0,0,0,0,0,59,25,84
Region I,"Pangasinan II, Binalonan",Alcala,407481,"San Quintin High School Foundation, Inc.","2444 San Quintin, Pangasinan",PANGASINAN,SAN QUINTIN,6th District,POBLACION ZONE I,Private,Sectarian ,School with no Annexes,Purely SHS,4,15,46,37,22,33,0,0,0,0,0,0,0,0,0,0,2,21,27,22,33,24,15,9,0,0,0,0,0,0,0,0,0,149,161,310
Region I,"Pangasinan II, Binalonan",Alcala,407609,University of Luzon - Pozorrubio Campus,"Cablong, Pozorrubio, Pangasinan",PANGASINAN,POZORRUBIO,5th District,CABLONG,Private,Sectarian ,School with no Annexes,Purely SHS,3,2,1,3,0,6,0,0,0,0,0,0,0,0,0,0,0,3,2,0,2,4,0,1,0,0,4,0,0,0,0,0,0,12,19,31
Region I,"Pangasinan II, Binalonan",Alcala,410487,"ST. JOHN PAUL II INSTITUTE OF TECHNOLOGY, TRAINING ASSESSMENT AND LEARNING CENTER INC.",0223 Cor. Our Lady of Peace Chapel,PANGASINAN,ALCALA,5th District,KASIKIS,Private,Non-Sectarian ,School with no Annexes,Purely SHS,5,2,31,36,0,0,0,0,0,0,52,31,0,0,0,0,1,1,6,2,0,0,0,0,0,0,4,9,0,0,0,0,0,99,81,180
Region I,"Pangasinan II, Binalonan",Binalonan I,407614,WCC Aeronautical and Technological College,"Binalonan Airfield, Canarvacanan, Binalonan, Pangasinan",PANGASINAN,BINALONAN,5th District,CANARVACANAN,Private,Sectarian ,School with no Annexes,Purely SHS,3,7,0,0,44,9,0,0,0,0,0,0,0,0,0,0,8,6,0,0,50,23,0,0,0,0,0,0,0,0,0,0,0,105,45,150
Region I,"Pangasinan II, Binalonan",San Quintin,407611,"Quintinians Technical Vocational School, Inc.","Rizal St., Poblacion, Zone 1, San Quintin, Pangasinan",PANGASINAN,SAN QUINTIN,6th District,POBLACION ZONE I,Private,Sectarian ,School with no Annexes,Purely SHS,0,0,0,0,0,0,0,0,0,0,62,43,0,0,0,0,0,0,0,0,0,0,0,0,0,0,69,44,0,0,0,0,0,131,87,218
Region I,"Pangasinan II, Binalonan",San Quintin,410604,"SAINT PASCHAL MEDICAL TRAINING CENTER AND TECHNICAL VOCATIONAL INSTITUTE, INC.",54 RIZAL ST. POBLACION ZONE II,PANGASINAN,SAN QUINTIN,6th District,POBLACION ZONE II,Private,Non-Sectarian ,School with no Annexes,Purely SHS,0,0,0,0,0,0,0,0,0,0,24,51,0,0,0,0,0,0,0,0,0,0,0,0,0,0,4,9,0,0,0,0,0,28,60,88
Region I,"Pangasinan II, Binalonan",Tayug I,408688,METRO GLOBAL INSTITUTE OF SCIENCE AND TECHNOLOGY INC.,Plaridel,PANGASINAN,TAYUG,6th District,BARANGAY D (POB.),Private,Non-Sectarian ,School with no Annexes,Purely SHS,0,0,0,0,0,0,0,0,0,0,13,9,0,0,0,0,0,0,0,0,0,0,0,0,0,0,17,11,0,0,0,0,0,30,20,50
Region I,"Pangasinan II, Binalonan",Umingan I,408691,STA. CATALINA'S COLLEGE OF SCIENCE & TECHNOLOGY UMINGAN BRANCH INC.,"UMINGAN, PANGASINAN",PANGASINAN,UMINGAN,6th District,CAURDANETAAN,Private,Non-Sectarian ,School with no Annexes,Purely SHS,0,0,0,0,0,0,0,0,0,0,46,7,0,0,0,0,0,0,0,0,0,0,0,0,0,0,32,6,0,0,0,0,0,78,13,91
Region I,"Pangasinan II, Binalonan",Umingan II,404143,"Hope of Melbourne Colleges Foundation, Inc.","Rizal St., Poblacion West, Umingan, Pangasinan",PANGASINAN,UMINGAN,6th District,POBLACION WEST,Private,Sectarian ,School with no Annexes,Purely SHS,0,0,0,0,0,0,0,0,0,0,17,27,0,0,0,0,0,0,0,0,0,0,0,0,0,0,10,22,0,0,0,0,0,27,49,76
Region I,Dagupan City,Dagupan City District I,401743,"Kingfisher School of Business and Finance, Inc","1131 McArthur Highway, Lucao District, Dagupan City Pangasinan",PANGASINAN,DAGUPAN CITY,4th District,LUCAO,Private,Non-Sectarian ,School with no Annexes,Purely SHS,28,38,3,5,38,30,0,0,0,0,0,0,0,0,0,0,17,33,3,6,10,30,0,0,0,0,0,0,0,0,0,0,0,99,142,241
Region I,Dagupan City,Dagupan City District I,401749,STI College - Dagupan,"Dr. G & M Devenecia Bldg., Arellano Street, Dagupan City, Pangasinan 2400",PANGASINAN,DAGUPAN CITY,4th District,BARANGAY I (T. BUGALLON),Private,Non-Sectarian ,School with no Annexes,Purely SHS,0,0,0,0,0,0,0,0,0,0,0,0,0,0,0,0,0,0,0,0,0,0,0,0,0,0,2,2,0,0,0,0,0,2,2,4
Region I,Dagupan City,Dagupan City District I,407300,Manila Montessori College International,"AB Fernandez Ave. cor Rizal Street, Dagupan City",PANGASINAN,DAGUPAN CITY,4th District,BARANGAY I (T. BUGALLON),Private,Non-Sectarian ,School with no Annexes,Purely SHS,0,0,0,0,0,0,0,0,0,0,3,4,0,0,0,0,0,0,0,0,0,0,0,0,0,0,10,5,0,0,0,0,0,13,9,22
Region I,Dagupan City,Dagupan City District III,400252,"University of Pangasinan, Inc.",Arellano St.,PANGASINAN,DAGUPAN CITY,4th District,PANTAL,Private,Non-Sectarian ,School with no Annexes,Purely SHS,50,125,75,114,309,479,25,13,0,0,65,31,0,0,0,0,62,152,56,105,374,498,40,14,0,0,100,36,0,0,0,0,0,1156,1567,2723
Region I,Dagupan City,Dagupan City District IV,409344,Graystone Institute of the Philippines (Training & Assessment Center) Inc.,A. B. Fernandez Avenue,PANGASINAN,DAGUPAN CITY,4th District,PANTAL,Private,Non-Sectarian ,School with no Annexes,Purely SHS,0,6,1,7,0,0,0,0,0,0,8,13,0,0,0,0,0,0,3,4,0,0,0,0,0,0,3,0,0,0,0,0,0,15,30,45
Region I,Dagupan City,Dagupan City District IV,410569,"Lite Technical and Educational Center, Inc.",Arellano St.,PANGASINAN,DAGUPAN CITY,4th District,PANTAL,Private,Non-Sectarian ,School with no Annexes,Purely SHS,0,0,0,0,0,0,0,0,0,0,9,6,0,0,0,0,0,0,0,0,0,0,0,0,0,0,6,6,0,0,0,0,0,15,12,27
Region I,Laoag City,Laoag City District I,401751,AMA Computer College-Laoag City Inc.,"Pacific Bldg. II Don E. Ruiz St.m Brgy. 17, Laoag City, Ilocos Norte",ILOCOS NORTE,LAOAG CITY (Capital),1st District,"BGY. NO. 17, SAN FRANCISCO (POB.)",Private,Non-Sectarian ,School with no Annexes,Purely SHS,0,0,1,0,3,0,0,0,0,0,2,0,0,0,0,0,3,4,0,8,1,2,0,0,0,0,1,0,0,0,0,0,0,11,14,25
Region I,Laoag City,Laoag City District I,401755,Data Center College of the Philippines of Laoag City,"Brgy. 8 A.G. Tupaz cor., M.V. Fariñas Sts. Laoag City",ILOCOS NORTE,LAOAG CITY (Capital),1st District,"BGY. NO. 8, SAN VICENTE (POB.)",Private,Sectarian ,School with no Annexes,Purely SHS,3,15,10,23,14,20,0,0,0,0,14,35,0,0,0,0,0,5,24,23,16,29,0,0,0,0,20,26,0,0,0,0,0,101,176,277
Region I,Laoag City,Laoag City District I,401756,STI College - Laoag,"JP Rizal cor. Don E. Ruiz St., Laoag City",ILOCOS NORTE,LAOAG CITY (Capital),1st District,"BGY. NO. 20, SAN MIGUEL (POB.)",Private,Non-Sectarian ,School with no Annexes,Purely SHS,0,0,0,0,8,9,0,0,0,0,1,3,0,0,0,0,0,0,0,0,8,13,0,0,0,0,0,0,0,0,0,0,0,17,25,42
Region I,Laoag City,Laoag City District I,407045,"Far East Computer Technology, Inc.","CAP Bldg., F.R. Castro Ave., Brgy. 9, Sta. Angela Laoag CIty, Ilocos Norte",ILOCOS NORTE,LAOAG CITY (Capital),1st District,"BGY. NO. 9, SANTA ANGELA (POB.)",Private,Non-Sectarian ,School with no Annexes,Purely SHS,0,0,0,5,0,0,0,0,0,0,0,0,0,0,0,0,0,0,3,2,0,0,0,7,0,0,3,12,0,0,0,0,0,6,26,32
Region I,San Carlos City,San Carlos City District I,408004,Virgen Milagrosa University Foundation Senior High School,Martin P Posadas Avenue,PANGASINAN,SAN CARLOS CITY,1st District,SAN PEDRO-TALOY,Private,Non-Sectarian ,School with no Annexes,Purely SHS,16,41,75,58,173,222,0,0,0,0,15,26,0,0,0,0,17,47,63,54,135,177,0,0,0,0,19,13,0,0,0,0,0,513,638,1151
Region I,San Carlos City,San Carlos City District I,409397,"Metro San Carlos Institute of Technology, Inc.",39 Palaris Street,PANGASINAN,SAN CARLOS CITY,3rd District,PALARIS (POB.),Private,Non-Sectarian ,School with no Annexes,Purely SHS,0,0,0,0,0,0,0,0,0,0,119,88,0,0,0,0,0,0,0,0,0,0,0,0,0,0,96,85,0,0,0,0,0,215,173,388
Region I,Urdaneta City,Urdaneta City District I,407610,"PHINMA-UPang College Urdaneta, Inc.","Nancayasan, McArthur Highway, Urdaneta City, Pangasinan",PANGASINAN,CITY OF URDANETA,5th District,NANCAYASAN,Private,Sectarian ,School with no Annexes,Purely SHS,17,67,70,62,214,284,22,4,0,0,34,21,0,0,0,0,25,100,17,40,173,256,34,19,0,0,34,18,0,0,0,0,0,640,871,1511
Region I,Urdaneta City,Urdaneta City District I,407619,ABE International College of Business and Accountancy-Urdaneta Campus,"Zion 2000, E. A. Cabrera Bldg.,  MacArthur Highway San Vicente, Urdaneta City, Pangasinan",PANGASINAN,CITY OF URDANETA,5th District,SAN VICENTE,Private,Sectarian ,School with no Annexes,Purely SHS,0,0,0,0,0,0,0,0,0,0,1,0,0,0,0,0,3,4,1,2,0,7,1,1,0,0,2,1,0,0,0,0,0,8,15,23
Region I,Urdaneta City,Urdaneta City District I,410181,"WELLCARE INSTITUTE OF SCIENCE AND TECHNOLOGY, INC.",Zone II,PANGASINAN,CITY OF URDANETA,5th District,PINMALUDPOD,Private,Non-Sectarian ,School with no Annexes,Purely SHS,0,0,9,29,0,0,0,0,0,0,71,75,0,0,0,0,0,0,5,4,0,0,0,0,0,0,26,36,0,0,0,0,0,111,144,255
Region I,Alaminos City,District I,401729,Golden West Colleges,"San Jose Drive, Alaminos City Pangasinan",PANGASINAN,CITY OF ALAMINOS,1st District,POBLACION,Private,Sectarian ,School with no Annexes,Purely SHS,2,7,14,17,5,15,0,0,0,0,0,6,0,0,0,0,4,12,6,13,14,16,3,0,0,0,2,8,0,0,0,0,0,50,94,144
Region I,Alaminos City,District I,404116,STI Alaminos,"8 Marcos Ave., Alaminos City, Pangasinan",PANGASINAN,CITY OF ALAMINOS,1st District,POBLACION,Private,Sectarian ,School with no Annexes,Purely SHS,0,0,0,0,0,0,0,0,0,0,0,0,0,0,0,0,0,0,0,0,0,0,0,0,0,0,4,4,0,0,0,0,0,4,4,8
Region I,Vigan City,District I,407616,Data Center College of the Philippines of Vigan City,Tamag,ILOCOS SUR,CITY OF VIGAN (Capital),1st District,TAMAG,Private,Non-Sectarian ,School with no Annexes,Purely SHS,2,3,4,1,0,0,0,0,0,0,6,12,0,0,0,0,1,3,6,6,0,0,0,0,0,0,8,6,0,0,0,0,0,27,31,58
Region I,Vigan City,District I,407620,STI College - Vigan,Burgos St.,ILOCOS SUR,CITY OF VIGAN (Capital),1st District,PANTAY DAYA,Private,Non-Sectarian ,School with no Annexes,Purely SHS,3,1,0,0,11,8,2,4,0,0,5,4,0,0,0,0,0,2,0,0,8,19,7,1,0,0,9,3,0,0,0,0,0,45,42,87
Region I,Vigan City,District I,407652,"Lyceum de Ylocos, Inc.",Jose Singson St.,ILOCOS SUR,CITY OF VIGAN (Capital),1st District,BARANGAY VIII,Private,Non-Sectarian ,School with no Annexes,Purely SHS,3,1,2,11,0,0,0,0,0,0,4,4,0,0,0,0,1,1,7,7,0,0,0,0,0,0,4,4,0,0,0,0,0,21,28,49
Region I,San Fernando City,San Fernando I,407650,AMA Computer College-San Fernando La Union Inc.,"MZF Bldg., Gen. Luna St.,",LA UNION,CITY OF SAN FERNANDO (Capital),1st District,BARANGAY I (POB.),Private,Sectarian ,School with no Annexes,Purely SHS,0,0,0,0,5,2,0,2,0,0,2,1,0,0,0,0,1,4,2,4,1,3,0,0,0,0,4,2,0,0,0,0,0,15,18,33
Region I,San Fernando City,San Fernando I,410179,"LA UNION COLLEGES OF SCIENCE & TECHNOLOGY, INC. - ANNEX","Mabini, Catbangen",LA UNION,CITY OF SAN FERNANDO (Capital),1st District,CATBANGEN,Private,Non-Sectarian ,Annex or Extension school(s),Purely SHS,0,0,1,2,0,0,0,0,0,0,3,2,0,0,0,0,0,0,0,0,0,0,0,0,0,0,0,0,0,0,0,0,0,4,4,8
Region I,San Fernando City,San Fernando I,410486,"ST. JOHN PAUL II INSTITUTE OF TECHNOLOGY, TRAINING ASSESSMENT AND LEARNING CENTER INC.",AGUILA ROAD,LA UNION,CITY OF SAN FERNANDO (Capital),1st District,SEVILLA,Private,Non-Sectarian ,School with no Annexes,Purely SHS,0,8,13,13,8,11,0,0,0,0,22,17,0,0,0,0,1,9,10,13,6,10,0,0,0,0,14,9,0,0,0,0,0,74,90,164
Region I,Batac City,Batac I,340748,Ferdinand E. Marcos SHS,"ASUNCION ST., BRGY. 1-S VALDEZ, CITY OF BATAC",ILOCOS NORTE,CITY OF BATAC,2nd District,VALDEZ POB. (CAOAYAN),Public,DepED Managed,School with no Annexes,Purely SHS,0,0,0,0,14,26,97,89,0,0,0,0,0,0,0,0,0,0,0,0,0,0,150,134,0,0,0,0,0,0,0,0,0,261,249,510
Region I,Batac City,Batac II,340747,Gen. Artemio Ricarte SHS,"BIL-LOCA, CITY OF BATAC",ILOCOS NORTE,CITY OF BATAC,2nd District,BIL-LOCA,Public,DepED Managed,School with no Annexes,Purely SHS,42,60,0,0,49,79,0,0,0,0,0,0,0,0,0,0,26,53,0,0,49,74,0,0,0,0,0,0,0,0,0,0,0,166,266,432
Region II,Isabela,Aurora,342077,Aurora Senior High School,"Ballesteros, Aurora, Isabela",ISABELA,AURORA,2nd District,BALLESTEROS,Public,DepED Managed,School with no Annexes,Purely SHS,22,74,110,153,50,87,0,0,0,0,165,59,0,0,5,11,22,65,161,170,57,104,0,0,0,0,188,71,0,0,1,5,0,781,799,1580
Region II,Isabela,Cabagan,305941,Rodolfo B. Albano Stand-Alone Senior High School,"Mabini Avenue, Catabayungan, Cabagan, Isabela",ISABELA,CABANGAN,1st District,CATABAYUNGAN,Public,DepED Managed,School with no Annexes,Purely SHS,5,31,99,87,39,67,0,0,0,0,120,55,0,0,0,0,5,31,92,108,24,26,0,0,0,0,90,45,0,0,0,0,0,474,450,924
Region II,Isabela,Cabagan,600012,Isabela State University-Cabagan,"National Highway, Garita, Cabagan, Isabela",ISABELA,CABANGAN,1st District,GARITA,SUCsLUCs,SUC Managed,School with no Annexes,Purely SHS,0,0,0,0,0,0,0,0,0,0,0,0,0,0,0,0,0,0,0,0,59,89,0,0,0,0,0,0,0,0,0,0,0,59,89,148
Region II,Isabela,Delfin Albano,305731,Delfin Albano (Magsaysay) Stand Alone Senior High School,"San Antonio, Delfin Albano, Isabela",ISABELA,DELFIN ALBANO (MAGSAYSAY),1st District,SAN ANTONIO,Public,DepED Managed,School with no Annexes,Purely SHS,6,22,45,39,20,39,0,0,0,0,69,42,0,0,0,0,7,12,25,28,24,43,0,0,0,0,44,27,0,0,0,0,0,240,252,492
Region II,Isabela,Gamu,342078,Isabela Sports Senior High School,"Alibagu, City of Ilagan, Isabela",ISABELA,ILAGAN CITY (CAPITAL),1st District,ALIBAGU,Public,DepED Managed,School with no Annexes,Purely SHS,0,0,0,0,0,0,0,0,0,0,0,0,29,13,0,0,0,0,0,0,0,0,0,0,0,0,0,0,25,13,0,0,0,54,26,80
Region II,Isabela,Roxas East,409368,"Worldstar College of Science and Technology, Inc.","National Highway, Bantug, Roxas, Isabela",ISABELA,ROXAS,2nd District,BANTUG (POB.),Private,Non-Sectarian ,School with no Annexes,Purely SHS,8,22,59,53,30,37,0,0,0,0,37,18,0,0,0,0,8,20,70,70,27,48,3,5,0,0,38,29,0,0,0,0,0,280,302,582
Region II,Isabela,Roxas East,600337,Isabela State University Roxas Campus,Luna-Rangayan,ISABELA,ROXAS,2nd District,LUNA (POB.),SUCsLUCs,SUC Managed,Annex or Extension school(s),Purely SHS,0,0,0,0,0,0,0,0,0,0,0,0,0,0,0,0,0,0,0,0,10,16,0,0,0,0,0,0,0,0,0,0,0,10,16,26
Region II,Isabela,Roxas West,305832,Roxas Stand Alone Senior High School,Purok 3,ISABELA,ROXAS,2nd District,SAN ANTONIO,Public,DepED Managed,School with no Annexes,Purely SHS,12,34,114,97,83,102,0,0,0,0,70,34,0,0,0,0,8,25,100,99,47,69,0,0,0,0,48,17,0,0,0,0,0,482,477,959
Region II,Isabela,San Mateo North,305943,Salinungan Stand-Alone Senior High School,Ramones St.,ISABELA,SAN MATEO,3rd District,SALINUNGAN WEST,Public,DepED Managed,School with no Annexes,Purely SHS,33,40,84,61,28,53,0,0,0,0,42,41,0,0,0,0,30,49,88,68,30,34,0,0,0,0,35,27,0,0,0,0,0,370,373,743
Region II,Isabela,Tumauini South,305942,Tumauini Stand-Alone Senior High Schol,"Annafunan, Tumauini Isabela",ISABELA,TUMAUINI,1st District,ANNAFUNAN,Public,DepED Managed,School with no Annexes,Purely SHS,19,29,65,82,24,51,0,0,0,0,168,98,0,0,0,0,12,30,76,75,0,0,0,0,0,0,145,86,0,0,0,0,0,509,451,960
Region II,Nueva Vizcaya,Bayombong I,407322,"Our Lady of Peace and Good Voyage Institute of Technology, Inc.","National Highway, Don Tomas Maddela, Bayombong, Nueva Vizcaya",NUEVA VIZCAYA,BAYOMBONG (Capital),Lone District,DISTRICT III POB. (DON M. PEREZ),Private,Non-Sectarian ,School with no Annexes,Purely SHS,0,0,0,0,0,0,17,18,0,0,0,0,0,0,0,0,0,0,0,0,0,0,5,3,0,0,0,0,0,0,0,0,0,22,21,43
Region II,Tuguegarao City,Tuguegarao North Educational Zone,305873,Cagayan National High School - Senior HS,Bagay Road,CAGAYAN,TUGUEGARAO CITY(Capital),3rd District,SAN GABRIEL,Public,DepED Managed,School with no Annexes,Purely SHS,43,101,320,289,163,321,65,74,0,0,204,110,38,15,14,16,48,121,231,222,132,276,46,43,0,0,138,67,27,5,20,10,0,1489,1670,3159
Region II,Tuguegarao City,Tuguegarao North Educational Zone,404185,"City Technological Institute, INC","Caritan Centro, Tuguegarao City",CAGAYAN,TUGUEGARAO CITY(Capital),3rd District,CARITAN CENTRO,Private,Non-Sectarian ,School with no Annexes,Purely SHS,0,0,0,0,0,0,0,0,0,0,6,0,0,0,0,0,0,0,0,0,0,0,0,0,0,0,0,0,0,0,0,0,0,6,0,6
Region II,Tuguegarao City,Tuguegarao North Educational Zone,407150,International School of Asia and the Pacific - Atulayan,"Atulayan Sur, Tuguegarao City",CAGAYAN,TUGUEGARAO CITY(Capital),3rd District,ATULAYAN SUR,Private,Non-Sectarian ,School with no Annexes,Purely SHS,2,2,9,4,8,9,0,0,0,0,2,3,0,0,0,0,2,5,7,9,6,17,0,0,0,0,0,0,0,0,0,0,0,36,49,85
Region II,Tuguegarao City,Tuguegarao West Educational Zone,401787,Maila Rosario College,"Diversion Road, San Gabriel Village, Tuguegarao City",CAGAYAN,TUGUEGARAO CITY(Capital),3rd District,SAN GABRIEL,Private,Sectarian ,School with no Annexes,Purely SHS,0,0,0,0,0,0,0,0,0,0,1,2,0,0,0,0,0,0,0,0,0,0,2,5,0,0,0,0,0,0,0,0,0,3,7,10
Region II,Tuguegarao City,Tuguegarao West Educational Zone,407148,Tuguegarao Training and Assessment Center Inc.,50 Quirino Street,CAGAYAN,TUGUEGARAO CITY(Capital),3rd District,UGAC NORTE,Private,Non-Sectarian ,School with no Annexes,Purely SHS,0,0,0,0,0,0,0,0,0,0,6,3,0,0,0,0,0,0,0,0,0,0,0,0,0,0,22,16,0,0,0,0,0,28,19,47
Region II,Tuguegarao City,Tuguegarao Northeast Educational Zone,401785,"AMA Computer College Tuguegarao Cagayan, Inc.",Caggay Highway,CAGAYAN,TUGUEGARAO CITY(Capital),3rd District,CAGGAY,Private,Non-Sectarian ,School with no Annexes,Purely SHS,0,3,0,2,0,0,0,0,0,0,0,3,0,0,0,0,0,4,3,3,2,3,1,1,0,0,1,5,0,0,0,0,0,7,24,31
Region II,Cauayan City,Cauayan East District,401768,"STI College Cauayan, Inc.","Piedad Bldg., National Highway, Cabaruan, Cauayan City, Isabela",ISABELA,CITY OF CAUAYAN,3rd District,CABARUAN,Private,Non-Sectarian ,School with no Annexes,Purely SHS,3,16,19,24,0,0,0,0,0,0,7,16,0,0,0,0,1,1,5,9,0,0,0,0,0,0,7,2,0,0,0,0,0,42,68,110
Region II,Cauayan City,Cauayan East District,404153,"East Asia International Systems College, Inc.",Roxas Street,ISABELA,CITY OF CAUAYAN,3rd District,DISTRICT II (POB.),Private,Non-Sectarian ,School with no Annexes,Purely SHS,0,0,0,0,0,0,0,0,0,0,13,18,0,0,0,0,0,0,0,0,0,0,0,0,0,0,7,11,0,0,0,0,0,20,29,49
Region II,Cauayan City,Cauayan North District,306055,Cauayan City Stand-Alone Senior High School,"P. Albano St., Turayong",ISABELA,CITY OF CAUAYAN,3rd District,TURAYONG,Public,DepED Managed,School with no Annexes,Purely SHS,38,149,309,289,132,248,0,0,0,0,252,157,31,13,10,16,42,137,366,313,149,271,0,0,0,0,233,98,7,1,14,15,0,1583,1707,3290
Region II,Cauayan City,Cauayan North District,400355,Isabela College of Arts and Technology Inc.,"Tagaran, Cauayan City, Isabela",ISABELA,CITY OF CAUAYAN,3rd District,TAGARAN,Private,Non-Sectarian ,Mother school,Purely SHS,0,0,0,0,0,0,0,0,0,0,0,0,0,0,0,0,0,0,0,0,0,0,0,0,17,5,0,0,0,0,0,0,0,17,5,22
Region II,Santiago City,Santiago East,401777,"AMA Computer College-Santiago City, Inc.","3rd/4th Floor Heritage Bldg., Maharlika Highway Malvar, Santiago City, Isabela",ISABELA,CITY OF SANTIAGO,4th District,MALVAR,Private,Non-Sectarian ,School with no Annexes,Purely SHS,0,3,0,0,1,2,0,0,0,0,2,0,0,0,0,0,0,0,0,5,3,8,0,0,0,0,2,1,0,0,0,0,0,8,19,27
Region II,Santiago City,Santiago East,401782,Cagayan Valley Computer and Information Technology College (CVCITC),"#28 Carreon St., Centro East, Santiago City",ISABELA,CITY OF SANTIAGO,4th District,CENTRO EAST (POB.),Private,Non-Sectarian ,School with no Annexes,Purely SHS,13,28,45,38,43,63,0,0,0,0,21,17,0,0,0,0,9,35,13,9,15,35,0,0,0,0,15,13,0,0,0,0,0,174,238,412
Region II,Santiago City,Santiago East,401783,Patria Sable Corpus College,"#08, Guzman St., Calao West, Santiago City, Isabela",ISABELA,CITY OF SANTIAGO,4th District,CALAO WEST (POB.),Private,Non-Sectarian ,School with no Annexes,Purely SHS,3,26,20,21,11,36,0,0,0,0,0,0,0,0,0,0,8,31,21,21,29,27,0,0,0,0,0,0,0,0,0,0,0,92,162,254
Region II,Santiago City,Santiago East,401784,Global Academy of Technology and Entrepreneurship,"8 Magsaysay Ave., Victory Norte, Santiago City, Isabela",ISABELA,CITY OF SANTIAGO,4th District,VICTORY NORTE,Private,Non-Sectarian ,School with no Annexes,Purely SHS,0,0,0,1,0,0,0,0,0,0,0,0,0,0,0,0,0,0,0,0,0,0,0,0,0,0,1,0,0,0,0,0,0,1,1,2
Region II,City of Ilagan,East,410331,Far East Computer Technology -Ilagan Inc.,Singson St,ISABELA,ILAGAN CITY (CAPITAL),1st District,CALAMAGUI 2ND,Private,Sectarian ,School with no Annexes,Purely SHS,0,0,1,2,0,0,0,0,0,0,0,0,0,0,0,0,0,0,1,1,0,0,0,0,0,0,1,0,0,0,0,0,0,3,3,6
Region III,San Jose City,San Jose City East,401965,"St. Augustine Foundation Colleges of Nueva Ecija, Inc.","Hermogenes Bldg., Bonifacio St., San Jose City, Nueva Ecija",NUEVA ECIJA,SAN JOSE CITY,2nd District,FERDINAND E. MARCOS POB. (DISTRICT II),Private,Non-Sectarian ,School with no Annexes,Purely SHS,8,14,0,0,0,0,0,0,0,0,23,29,0,0,0,0,3,4,0,0,0,0,0,0,0,0,11,21,0,0,0,0,0,45,68,113
Region III,San Jose City,San Jose City East,401967,STI COLLEGE SAN JOSE INC,"A.O. Pascual cor Rizal St., San Jose City, Nueva Ecija 3121",NUEVA ECIJA,SAN JOSE CITY,2nd District,FERDINAND E. MARCOS POB. (DISTRICT II),Private,Non-Sectarian ,School with no Annexes,Purely SHS,2,12,7,14,0,0,0,0,0,0,18,8,0,0,0,0,0,0,3,14,0,0,0,0,0,0,10,4,0,0,0,0,0,40,52,92
Region III,San Jose City,San Jose City East,410319,Araullo University San Jose,"Rizal Street, San Jose City, Nueva Ecija",NUEVA ECIJA,SAN JOSE CITY,2nd District,FERDINAND E. MARCOS POB. (DISTRICT II),Private,Non-Sectarian ,School with no Annexes,Purely SHS,23,55,82,67,72,71,23,24,0,0,0,0,0,0,0,0,21,75,73,92,76,134,46,42,0,0,0,0,0,0,0,0,0,416,560,976
Region III,Aurora,Baler,305191,Baler Stand Alone Senior High School,"Brgy. Calabuanan, Baler, Aurora",AURORA,BALER  (Capital),Lone District,CALABUANAN,Public,DepED Managed,School with no Annexes,Purely SHS,1,7,45,41,0,0,0,0,0,0,30,17,0,0,0,0,5,12,58,20,0,0,0,0,0,0,7,11,0,0,0,0,0,146,108,254
Region III,Bataan,Limay,409809,"West Philippines Institute of Tourism Science and Technology, Inc.","Townsite, Limay, Bataan",BATAAN,LIMAY,2nd District,TOWNSITE,Private,Non-Sectarian ,School with no Annexes,Purely SHS,9,35,20,32,64,80,0,0,0,0,28,30,0,0,0,0,6,19,16,18,54,56,0,0,0,0,17,13,0,0,0,0,0,214,283,497
Region III,Bataan,Mariveles,306618,Mariveles NHS - Camaya Campus,Camaya,BATAAN,MARIVELES,2nd District,CAMAYA,Public,DepED Managed,School with no Annexes,Purely SHS,28,57,151,151,61,105,0,0,0,0,169,90,0,0,0,0,45,117,137,141,58,95,11,8,0,0,176,69,0,0,0,0,0,836,833,1669
Region III,Bataan,Mariveles,361011,Mariveles SHS - Sitio Mabuhay,"SITIO MABUHAY, CABCABEN, MARIVELES, BATAAN",BATAAN,MARIVELES,2nd District,CABCABEN,Public,DepED Managed,School with no Annexes,Purely SHS,26,57,67,101,28,41,0,0,0,0,146,66,0,0,0,0,32,54,72,76,57,50,16,11,0,0,116,46,0,0,0,0,0,560,502,1062
Region III,Bataan,Mariveles,404290,SOFTNET Information Technology Center,"2nd Flr., SFB, FAB, Mariveles, Bataan",BATAAN,MARIVELES,2nd District,MALAYA,Private,Non-Sectarian ,School with no Annexes,Purely SHS,9,28,19,28,0,0,0,0,0,0,29,13,0,0,0,0,9,25,17,27,0,0,0,0,0,0,56,25,0,0,0,0,0,139,146,285
Region III,Bataan,Orani,306270,Gov. Efren B. Pascual Sr. Orani Integrated Central School,"Mulawin, Orani, Bataan",BATAAN,ORANI,1st District,MULAWIN,Public,DepED Managed,School with no Annexes,Purely SHS,17,54,110,97,56,74,0,0,0,0,100,60,0,0,0,0,24,57,93,86,45,79,15,8,0,0,169,63,0,0,0,0,0,629,578,1207
